{
  "migration_id": "0715-1820",
  "last_updated": "2026-07-15T18:36:00Z",
  "current_phase": "estimate",
  "phases": {
    "discover": "completed",
    "clarify": "completed",
    "design": "completed",
    "estimate": "in_progress",
    "workshop": "pending",
    "generate": "pending",
    "feedback": "pending"
  }
}
