{
  "migration_id": "0721-1725",
  "last_updated": "2026-07-21T17:56:00Z",
  "current_phase": "estimate",
  "phases": {
    "prescan": "completed",
    "discover": "completed",
    "clarify": "completed",
    "recommend": "completed",
    "estimate": "pending",
    "workshop": "pending",
    "generate": "pending",
    "report": "pending"
  }
}
