{
  "migration_id": "0719-vw",
  "last_updated": "2026-07-19T19:05:00Z",
  "current_phase": "estimate",
  "phases": {
    "prescan": "completed",
    "discover": "completed",
    "clarify": "completed",
    "recommend": "completed",
    "estimate": "completed",
    "workshop": "in_progress",
    "generate": "pending",
    "report": "pending"
  }
}
